{
 "version": 2,
 "generated_at": "2026-10-28",
 "source": "docs/ModernDocs/client-zero/ontology/processes.yaml",
 "rules": [
  {
   "id": "P-owner",
   "name": "Instance has an owner",
   "check": "fact_present",
   "fact": "owner",
   "description": "The instance carries an `owner` fact (a role or person)."
  },
  {
   "id": "P-source",
   "name": "Instance names its source",
   "check": "fact_present",
   "fact": "source",
   "description": "The instance carries a `source` fact pointing at the file, document or system it came from."
  },
  {
   "id": "P-dated",
   "name": "Current step is dated",
   "check": "fact_present",
   "fact": "current_step",
   "description": "The loader wrote a dated `current_step` fact (valid_from), so the flow view can measure the step."
  },
  {
   "id": "P-review",
   "name": "Review date lies ahead",
   "check": "date_not_past",
   "fact": "review_date",
   "description": "The risk's review date has not passed."
  },
  {
   "id": "P-thresholds",
   "name": "Keep and kill thresholds set",
   "check": "facts_present",
   "facts": [
    "keep_threshold",
    "kill_threshold",
    "minimum_sample"
   ],
   "description": "Registered before the start: thresholds and the minimum sample are set (goal rule 3); an `exploration` instance fails this on purpose."
  }
 ],
 "report_rules": [
  {
   "id": "R0",
   "name": "Conventions",
   "applies_to": [
    "*"
   ],
   "description": "Every node has a key fact; relations come from relations.yaml and respect domain and range; numbers are text with a unit; type descriptions carry the [level=…] header.",
   "computed_by": "scripts/client_zero/rules_report.py"
  },
  {
   "id": "R1",
   "name": "Approved plan is complete",
   "applies_to": [
    "FeaturePlan"
   ],
   "description": "An approved plan has an owner, affects at least one component, serves a capability and is motivated by a goal or justified by a hypothesis.",
   "computed_by": "scripts/client_zero/rules_report.py"
  },
  {
   "id": "R2",
   "name": "Done means evidenced",
   "applies_to": [
    "FeaturePlan"
   ],
   "description": "An implemented or released plan has at least one implementing commit and at least one passing test run or Alloy check from CI (local runs are not evidence).",
   "computed_by": "scripts/client_zero/rules_report.py"
  },
  {
   "id": "R3",
   "name": "Decision is complete",
   "applies_to": [
    "Decision"
   ],
   "description": "A decision names what it affects, has an owner and, once decided, a date; a superseded one names its successor.",
   "computed_by": "scripts/client_zero/rules_report.py"
  },
  {
   "id": "R4",
   "name": "Risk is handled",
   "applies_to": [
    "Risk"
   ],
   "description": "A risk has an owner and a review date, and an open risk has a mitigation or an explicit acceptance.",
   "computed_by": "scripts/client_zero/rules_report.py"
  },
  {
   "id": "R5",
   "name": "Record is linked and fresh",
   "applies_to": [
    "Record"
   ],
   "description": "A record describes something or is evidence for it, and is not stale.",
   "computed_by": "scripts/client_zero/rules_report.py"
  },
  {
   "id": "R6",
   "name": "Ground truth resolves",
   "applies_to": [
    "Component",
    "Invariant"
   ],
   "description": "An L2 component resolves to an existing source path; an invariant has a passing Alloy check from CI or a decided decision covering it.",
   "computed_by": "scripts/client_zero/rules_report.py"
  },
  {
   "id": "R7",
   "name": "Pre-mortem before big bets",
   "applies_to": [
    "FeaturePlan",
    "Goal",
    "Decision"
   ],
   "description": "A large plan (50 sp or more), a quarterly goal or a hard-to-reverse decision is examined by a pre-mortem that raised at least one risk and one tripwire.",
   "computed_by": "scripts/client_zero/rules_report.py"
  },
  {
   "id": "R8",
   "name": "Plain-language descriptions",
   "applies_to": [
    "*"
   ],
   "description": "Every type, attribute, relation and enum value has a description in descriptions.yaml.",
   "computed_by": "scripts/client_zero/rules_report.py"
  }
 ],
 "processes": [
  {
   "key": "PROC-feature-lifecycle",
   "name": "Feature lifecycle",
   "description": "How a feature goes from idea to release at Knovas: a plan file is the brief; it names the components it changes, the capability and goal it serves, the contracts and invariants it must keep; an Alloy model and (above the size threshold) a pre-mortem precede approval; commits implement it; tests and checks verify it; a release ships it.",
   "instance_types": [
    "FeaturePlan"
   ],
   "governing_fact": "status",
   "status_map": {
    "FeaturePlan": {
     "draft": "brief",
     "review": "brief",
     "approved": "approved",
     "implementing": "implementing",
     "verified": "verified",
     "implemented": "implemented",
     "released": "released",
     "killed": "killed"
    }
   },
   "owner_role": "ROLE-ENGINE-OWNER",
   "exists_today": "guides/planning-new-features.md, feature-plan template",
   "context": [
    {
     "type": "Decision",
     "required": false,
     "min_count": 1,
     "path": [
      {
       "relation": "affects",
       "direction": "in",
       "to_type": "Decision"
      }
     ],
     "verified": true
    },
    {
     "type": "Risk",
     "required": false,
     "min_count": 1,
     "path": [
      {
       "relation": "affects",
       "direction": "in",
       "to_type": "Risk"
      }
     ],
     "verified": true
    },
    {
     "type": "Risk",
     "required": false,
     "min_count": 1,
     "path": [
      {
       "relation": "mitigated_by",
       "direction": "in",
       "to_type": "Risk"
      }
     ],
     "verified": true
    },
    {
     "type": "RunEvent",
     "required": false,
     "min_count": 1,
     "path": [
      {
       "relation": "touches",
       "direction": "in",
       "to_type": "RunEvent"
      }
     ],
     "verified": true
    },
    {
     "type": "Invariant",
     "required": false,
     "min_count": 1,
     "path": [
      {
       "relation": "affects",
       "direction": "out",
       "to_type": "Component"
      },
      {
       "relation": "keeps",
       "direction": "out",
       "to_type": "Invariant"
      }
     ],
     "verified": true,
     "label": "via component (all)"
    },
    {
     "type": "ComponentContract",
     "required": false,
     "min_count": 1,
     "path": [
      {
       "relation": "affects",
       "direction": "out",
       "to_type": "Component"
      },
      {
       "relation": "governs",
       "direction": "in",
       "to_type": "ComponentContract"
      }
     ],
     "verified": true,
     "label": "via component (all)"
    },
    {
     "type": "AlloyCheck",
     "required": false,
     "min_count": 1,
     "path": [
      {
       "relation": "affects",
       "direction": "out",
       "to_type": "Component"
      },
      {
       "relation": "verifies",
       "direction": "in",
       "to_type": "AlloyCheck"
      }
     ],
     "verified": true,
     "label": "via component (all)"
    }
   ],
   "steps": [
    {
     "id": "idea",
     "key": "STEP-feature-lifecycle-idea",
     "order": 1,
     "name": "idea",
     "owner_role": "ROLE-ENGINE-OWNER",
     "description": "An idea without a plan file; not visible to the brain until the brief exists.",
     "resting": false,
     "requires": [],
     "produces": [],
     "exit_criteria": []
    },
    {
     "id": "brief",
     "key": "STEP-feature-lifecycle-brief",
     "order": 2,
     "name": "brief",
     "owner_role": "ROLE-ENGINE-OWNER",
     "description": "The plan file: problem, design, affected components, capability and goal; the contracts and invariants it keeps, the Alloy model and the pre-mortem are its required artefacts (DEC-0015).",
     "resting": false,
     "requires": [],
     "produces": [
      {
       "type": "Record",
       "required": true,
       "min_count": 1,
       "path": [
        {
         "relation": "describes",
         "direction": "in",
         "to_type": "Record"
        }
       ],
       "verified": true,
       "note": "the plan file itself"
      },
      {
       "type": "Component",
       "required": true,
       "min_count": 1,
       "path": [
        {
         "relation": "affects",
         "direction": "out",
         "to_type": "Component"
        }
       ],
       "verified": true
      },
      {
       "type": "Capability",
       "required": true,
       "min_count": 1,
       "path": [
        {
         "relation": "serves",
         "direction": "out",
         "to_type": "Capability"
        }
       ],
       "verified": true
      },
      {
       "type": "Goal",
       "required": true,
       "min_count": 1,
       "path": [
        {
         "relation": "motivated_by",
         "direction": "out",
         "to_type": "Goal"
        }
       ],
       "verified": true,
       "alternative": {
        "type": "Hypothesis",
        "path": [
         {
          "relation": "justified_by",
          "direction": "out",
          "to_type": "Hypothesis"
         }
        ]
       }
      },
      {
       "type": "Invariant",
       "required": true,
       "min_count": 1,
       "path": [
        {
         "relation": "keeps",
         "direction": "out",
         "to_type": "Invariant"
        }
       ],
       "verified": true,
       "note": "contracts-and-invariants step: the plan's own Golden Invariants table or .ai.yaml (DEC-0023)"
      },
      {
       "type": "ComponentContract",
       "required": false,
       "min_count": 1,
       "path": [
        {
         "relation": "keeps",
         "direction": "out",
         "to_type": "ComponentContract"
        }
       ],
       "verified": true,
       "note": "contracts-and-invariants step: the plan's contract deltas that the component spec defines (DEC-0023)"
      },
      {
       "type": "AlloyCheck",
       "required": true,
       "min_count": 1,
       "path": [
        {